{
  "document_type": "stats_report",
  "locale": "en",
  "meta": {
    "title": "Momo Platform Q1 2025 Operations Report",
    "subtitle": "User growth accelerating, paid conversion hits all-time high",
    "eyebrow": "Momo Paper / stats_report / en",
    "period": "2025.01 - 2025.03"
  },
  "sections": {
    "kpis": [
      { "label": "MAU", "value": "1.28M", "change": "+18%", "trend": "up" },
      { "label": "Paid Users", "value": "42K", "change": "+32%", "trend": "up" },
      { "label": "Conversion", "value": "3.28%", "change": "+0.45%", "trend": "up" },
      { "label": "ARR", "value": "$5.2M", "change": "+28%", "trend": "up" },
      { "label": "NPS", "value": "52", "change": "+8", "trend": "up" },
      { "label": "Churn", "value": "2.1%", "change": "-0.3%", "trend": "down" }
    ],
    "trends": {
      "body": [
        "Q1 continued the strong momentum from Q4, with MAU crossing 1.2M. Growth was driven by: 1) word-of-mouth from AI assistant features; 2) the Notion integration launch bringing new users.",
        "Paid conversion improved from 2.83% to 3.28%, primarily due to the new pricing strategy and clearer upgrade prompts."
      ],
      "chart": {
        "type": "line",
        "title": "MAU Growth Trend (10K)",
        "height": 260,
        "data": {
          "labels": ["Oct", "Nov", "Dec", "Jan", "Feb", "Mar"],
          "values": [850, 920, 980, 1080, 1180, 1280]
        }
      },
      "anomalies": [
        "A 15-minute service outage in mid-February caused a 35% drop in daily signups. Root cause fixed (database connection pool misconfiguration).",
        "Japan market showed abnormal growth in March (+120%), traced to a YouTube influencer recommendation."
      ]
    },
    "segments": [
      {
        "name": "By User Type",
        "body": [
          "Individual users account for 72%, team users 28%. Team users have 4.5x higher ARPU and represent the key growth focus."
        ]
      },
      {
        "name": "By Region",
        "body": [
          "Domestic market 55%, North America 25%, Europe 12%, others 8%. Japan jumped from 2% to 5% in March."
        ]
      },
      {
        "name": "By Feature",
        "body": [
          "AI assistant is the most popular new feature, used by 68% of weekly active users. Real-time collaboration at 42% and rising."
        ]
      }
    ],
    "method": {
      "body": [
        "Data source: Internal data warehouse (Snowflake). Metrics consistent with prior quarter definitions. MAU = users with at least one login in the month. Paid users = users with active subscription during the period."
      ]
    }
  }
}
