{
  "document_type": "stats_report",
  "locale": "zh-CN",
  "meta": {
    "title": "Momo Platform 2025 Q1 运营报告",
    "subtitle": "用户增长加速，付费转化率创历史新高",
    "eyebrow": "Momo Paper / stats_report / zh-CN",
    "period": "2025.01 - 2025.03"
  },
  "sections": {
    "kpis": [
      { "label": "MAU", "value": "128万", "change": "+18%", "trend": "up" },
      { "label": "付费用户", "value": "4.2万", "change": "+32%", "trend": "up" },
      { "label": "付费转化率", "value": "3.28%", "change": "+0.45%", "trend": "up" },
      { "label": "ARR", "value": "¥3,600万", "change": "+28%", "trend": "up" },
      { "label": "NPS", "value": "52", "change": "+8", "trend": "up" },
      { "label": "流失率", "value": "2.1%", "change": "-0.3%", "trend": "down" }
    ],
    "trends": {
      "body": [
        "Q1 延续了 Q4 的增长势头，MAU 突破 120 万大关。增长主要来源于：1）AI 助手功能的口碑传播；2）与 Notion 的集成上线带来的新增用户。",
        "付费转化率从上季度的 2.83% 提升至 3.28%，主要得益于新的定价策略和更清晰的付费引导。"
      ],
      "chart": {
        "type": "line",
        "title": "MAU 增长趋势（万）",
        "height": 260,
        "data": {
          "labels": ["Oct", "Nov", "Dec", "Jan", "Feb", "Mar"],
          "values": [85, 92, 98, 108, 118, 128]
        }
      },
      "anomalies": [
        "2 月中旬出现一次服务中断（约 15 分钟），导致当日注册量下降 35%。已修复根因（数据库连接池配置问题）。",
        "日本市场 3 月增长异常（+120%），调查发现是一位 KOL 在 YouTube 推荐了我们的产品。"
      ]
    },
    "segments": [
      {
        "name": "按用户类型",
        "body": [
          "个人用户占比 72%，团队用户占比 28%。团队用户的 ARPU 是个人用户的 4.5 倍，是未来增长的重点。"
        ]
      },
      {
        "name": "按地域",
        "body": [
          "国内市场占比 55%，北美 25%，欧洲 12%，其他 8%。日本市场在 3 月异军突起，占比从 2% 跳升至 5%。"
        ]
      },
      {
        "name": "按功能使用",
        "body": [
          "AI 助手是最受欢迎的新功能，68% 的周活用户至少使用过一次。实时协作功能使用率 42%，呈上升趋势。"
        ]
      }
    ],
    "method": {
      "body": [
        "数据来源：内部数据仓库（Snowflake），统计口径与上季度保持一致。MAU 定义为当月至少登录一次的用户。付费用户定义为在统计周期内有有效订阅的用户。"
      ]
    }
  }
}
